{
  "plan_id": "SYN_108_gold",
  "task_id": "SYN_108",
  "target_entity": "canonical_activity_summary",
  "field_mappings": [
    {
      "target_field": "steps",
      "operation": "copy",
      "source_paths": [
        "$.step_count"
      ]
    }
  ],
  "joins": [],
  "filters": [],
  "aggregations": [],
  "assumptions": [
    "Common synonym."
  ]
}