{
  "plan_id": "GB_007_gold",
  "task_id": "GB_007",
  "target_entity": "navigation_session_summary",
  "group_by_paths": [
    "$.SESSION"
  ],
  "field_mappings": [
    {
      "target_field": "session_id",
      "operation": "copy",
      "source_paths": [
        "$.SESSION"
      ]
    },
    {
      "target_field": "user_external_id",
      "operation": "copy",
      "source_paths": [
        "$.UID"
      ]
    },
    {
      "target_field": "app",
      "operation": "copy",
      "source_paths": [
        "$.APP"
      ]
    },
    {
      "target_field": "campaign",
      "operation": "copy",
      "source_paths": [
        "$.FOR_CAMPAIGN"
      ]
    }
  ],
  "joins": [],
  "filters": [],
  "aggregations": [
    {
      "target_field": "session_start_time",
      "function": "first",
      "source_path": "$.X_DATE"
    },
    {
      "target_field": "session_end_time",
      "function": "latest",
      "source_path": "$.X_DATE"
    },
    {
      "target_field": "page_visit_count",
      "function": "count",
      "source_path": "$.URI"
    },
    {
      "target_field": "first_uri",
      "function": "first",
      "source_path": "$.URI"
    },
    {
      "target_field": "last_uri",
      "function": "latest",
      "source_path": "$.URI"
    },
    {
      "target_field": "distinct_uri_count",
      "function": "distinct_count",
      "source_path": "$.URI"
    }
  ],
  "assumptions": [
    "Records are grouped by SESSION.",
    "Within a group, input order reflects event order.",
    "Field mappings read from the first record in the group."
  ],
  "confidence": 1.0
}