{
  "plan_id": "SYN_302_gold",
  "task_id": "SYN_302",
  "target_entity": "order_with_customer",
  "field_mappings": [
    {
      "target_field": "order_id",
      "operation": "copy",
      "source_paths": [
        "$.orders.id"
      ]
    },
    {
      "target_field": "customer_id",
      "operation": "copy",
      "source_paths": [
        "$.orders.customer_id"
      ]
    },
    {
      "target_field": "customer_email",
      "operation": "copy",
      "source_paths": [
        "$.customers.email"
      ]
    },
    {
      "target_field": "customer_country",
      "operation": "copy",
      "source_paths": [
        "$.customers.country"
      ]
    },
    {
      "target_field": "customer_tier",
      "operation": "copy",
      "source_paths": [
        "$.customers.tier"
      ]
    },
    {
      "target_field": "order_status",
      "operation": "copy",
      "source_paths": [
        "$.orders.status"
      ]
    },
    {
      "target_field": "total_amount",
      "operation": "copy",
      "source_paths": [
        "$.orders.total_amount"
      ]
    }
  ],
  "joins": [
    {
      "left_path": "$.orders",
      "right_path": "$.customers",
      "left_key": "customer_id",
      "right_key": "id",
      "join_type": "inner"
    }
  ],
  "filters": [],
  "aggregations": [],
  "assumptions": [
    "Only matched orders should remain under inner join."
  ]
}