{
  "plan_id": "SYN_102_gold",
  "task_id": "SYN_102",
  "target_entity": "canonical_user_profile",
  "field_mappings": [
    {
      "target_field": "birth_date",
      "operation": "copy",
      "source_paths": [
        "$.date_of_birth"
      ]
    }
  ],
  "joins": [],
  "filters": [],
  "aggregations": [],
  "assumptions": [
    "Common synonym."
  ]
}