{
  "plan_id": "SYN_112_gold",
  "task_id": "SYN_112",
  "target_entity": "canonical_activity_summary",
  "field_mappings": [
    {
      "target_field": "steps",
      "operation": "copy",
      "source_paths": [
        "$.participant_id"
      ]
    }
  ],
  "joins": [],
  "filters": [],
  "aggregations": [],
  "assumptions": [
    "Close competing identifier."
  ]
}